{
  "schema_version": 1,
  "family_id": "family-f02-28",
  "profile_id": "profile-cemig-eo-r3",
  "source_id": "F02",
  "variants": [
    {
      "id": "cemig-eo-r3-s28-v001",
      "class_code": "PONTO_CONEXAO",
      "role": "operational",
      "destination": "network_context",
      "source_ref": {
        "source_id": "F02",
        "pdf_page": 32,
        "locator": "§28; página PDF/impressa 32; desenho/linha 1 da seção nesta página",
        "review_status": "visual_checked"
      },
      "visual_note": "Disco roxo",
      "recognition": {
        "status": "enabled",
        "grammar": {
          "kind": "terminal_disc",
          "fill": "purple",
          "min_span": 1.0,
          "max_span": 4.0,
          "terminal_line": true
        },
        "negative_examples": [
          "Exemplar de legenda/tabela não é ocorrência operacional",
          "Glifos, molduras e líderes de anotação",
          "Disco verde, vermelho, preto ou lilás claro, mesmo com linha terminal",
          "Disco roxo isolado, sem linha de rede terminando no centro",
          "Disco roxo no meio de uma linha que passa por ele",
          "Disco roxo grande, com texto dentro ou coberto por preenchimento posterior",
          "Triângulo ou outra forma roxa com linha terminando nela"
        ]
      }
    },
    {
      "id": "cemig-eo-r3-s28-v002",
      "class_code": "PONTO_CONEXAO",
      "role": "operational",
      "destination": "network_context",
      "source_ref": {
        "source_id": "F02",
        "pdf_page": 32,
        "locator": "§28; página PDF/impressa 32; desenho/linha 2 da seção nesta página",
        "review_status": "visual_checked"
      },
      "visual_note": "EC em quadrado laranja",
      "recognition": {
        "status": "enabled",
        "grammar": {
          "max_span": 72,
          "label": "EC",
          "kind": "label_in_frame",
          "frame": "rectangle"
        },
        "negative_examples": [
          "Exemplar de legenda/tabela não é ocorrência operacional",
          "Glifos, molduras e líderes de anotação",
          "Texto ou moldura isolados sem a composição geométrica exigida"
        ]
      }
    },
    {
      "id": "cemig-eo-r3-s28-v003",
      "class_code": "PONTO_CONEXAO",
      "role": "operational",
      "destination": "network_context",
      "source_ref": {
        "source_id": "F02",
        "pdf_page": 32,
        "locator": "§28; página PDF/impressa 32; desenho/linha 3 da seção nesta página",
        "review_status": "visual_checked"
      },
      "visual_note": "EC em círculo lilás",
      "recognition": {
        "status": "enabled",
        "grammar": {
          "max_span": 72,
          "label": "EC",
          "kind": "label_in_frame",
          "frame": "ellipse"
        },
        "negative_examples": [
          "Exemplar de legenda/tabela não é ocorrência operacional",
          "Glifos, molduras e líderes de anotação",
          "Texto ou moldura isolados sem a composição geométrica exigida"
        ]
      }
    },
    {
      "id": "cemig-eo-r3-s28-v004",
      "class_code": "PONTO_CONEXAO",
      "role": "operational",
      "destination": "network_context",
      "source_ref": {
        "source_id": "F02",
        "pdf_page": 32,
        "locator": "§28; página PDF/impressa 32; desenho/linha 4 da seção nesta página",
        "review_status": "visual_checked"
      },
      "visual_note": "ES em círculo violeta",
      "recognition": {
        "status": "enabled",
        "grammar": {
          "max_span": 72,
          "label": "ES",
          "kind": "label_in_frame",
          "frame": "ellipse"
        },
        "negative_examples": [
          "Exemplar de legenda/tabela não é ocorrência operacional",
          "Glifos, molduras e líderes de anotação",
          "Texto ou moldura isolados sem a composição geométrica exigida"
        ]
      }
    }
  ]
}
