{
  "schema_version": 1,
  "family_id": "family-f02-10",
  "profile_id": "profile-cemig-eo-r3",
  "source_id": "F02",
  "variants": [
    {
      "id": "cemig-eo-r3-s10-v001",
      "class_code": "ESTRUTURA_POSTE_MT",
      "role": "operational",
      "destination": "support_review",
      "source_ref": {
        "source_id": "F02",
        "pdf_page": 13,
        "locator": "§10; página PDF/impressa 13; desenho/linha 1 da seção nesta página",
        "review_status": "visual_checked"
      },
      "visual_note": "Retângulo horizontal",
      "recognition": {
        "status": "pending",
        "reason": "Forma E01: Retângulo horizontal. Retângulos simples se confundem com §12; contorno ortogonal desta variante ainda não tem positivo/negativo independente.",
        "negative_examples": [
          "Exemplar de legenda/tabela não é ocorrência operacional",
          "Glifos, molduras e líderes de anotação"
        ]
      }
    },
    {
      "id": "cemig-eo-r3-s10-v002",
      "class_code": "ESTRUTURA_POSTE_MT",
      "role": "operational",
      "destination": "support_review",
      "source_ref": {
        "source_id": "F02",
        "pdf_page": 13,
        "locator": "§10; página PDF/impressa 13; desenho/linha 2 da seção nesta página",
        "review_status": "visual_checked"
      },
      "visual_note": "Quadrado",
      "recognition": {
        "status": "pending",
        "reason": "Forma E01: Quadrado. Retângulos simples se confundem com §12; contorno ortogonal desta variante ainda não tem positivo/negativo independente.",
        "negative_examples": [
          "Exemplar de legenda/tabela não é ocorrência operacional",
          "Glifos, molduras e líderes de anotação"
        ]
      }
    },
    {
      "id": "cemig-eo-r3-s10-v003",
      "class_code": "ESTRUTURA_POSTE_MT",
      "role": "operational",
      "destination": "support_review",
      "source_ref": {
        "source_id": "F02",
        "pdf_page": 13,
        "locator": "§10; página PDF/impressa 13; desenho/linha 3 da seção nesta página",
        "review_status": "visual_checked"
      },
      "visual_note": "Retângulo horizontal maior",
      "recognition": {
        "status": "pending",
        "reason": "Forma E01: Retângulo horizontal maior. Retângulos simples se confundem com §12; contorno ortogonal desta variante ainda não tem positivo/negativo independente.",
        "negative_examples": [
          "Exemplar de legenda/tabela não é ocorrência operacional",
          "Glifos, molduras e líderes de anotação"
        ]
      }
    },
    {
      "id": "cemig-eo-r3-s10-v004",
      "class_code": "ESTRUTURA_POSTE_MT",
      "role": "operational",
      "destination": "support_review",
      "source_ref": {
        "source_id": "F02",
        "pdf_page": 13,
        "locator": "§10; página PDF/impressa 13; desenho/linha 4 da seção nesta página",
        "review_status": "visual_checked"
      },
      "visual_note": "Contorno em L",
      "recognition": {
        "status": "pending",
        "reason": "Forma E01: Contorno em L. Retângulos simples se confundem com §12; contorno ortogonal desta variante ainda não tem positivo/negativo independente.",
        "negative_examples": [
          "Exemplar de legenda/tabela não é ocorrência operacional",
          "Glifos, molduras e líderes de anotação"
        ]
      }
    },
    {
      "id": "cemig-eo-r3-s10-v005",
      "class_code": "ESTRUTURA_POSTE_MT",
      "role": "operational",
      "destination": "support_review",
      "source_ref": {
        "source_id": "F02",
        "pdf_page": 13,
        "locator": "§10; página PDF/impressa 13; desenho/linha 5 da seção nesta página",
        "review_status": "visual_checked"
      },
      "visual_note": "Contorno ortogonal curto",
      "recognition": {
        "status": "pending",
        "reason": "Forma E01: Contorno ortogonal curto. Retângulos simples se confundem com §12; contorno ortogonal desta variante ainda não tem positivo/negativo independente.",
        "negative_examples": [
          "Exemplar de legenda/tabela não é ocorrência operacional",
          "Glifos, molduras e líderes de anotação"
        ]
      }
    }
  ]
}
