{
  "schema_version": 1,
  "family_id": "family-f02-08",
  "profile_id": "profile-cemig-eo-r3",
  "source_id": "F02",
  "variants": [
    {
      "id": "cemig-eo-r3-s08-v001",
      "class_code": "POSTE_AT",
      "role": "operational",
      "destination": "support_review",
      "source_ref": {
        "source_id": "F02",
        "pdf_page": 12,
        "locator": "§8; página PDF/impressa 12; desenho/linha 1 da seção nesta página",
        "review_status": "visual_checked"
      },
      "visual_note": "Dois círculos",
      "recognition": {
        "status": "pending",
        "reason": "Forma E01: Dois círculos. Círculo, retângulo e octógono repetem §3 e outros suportes; material e rede AT exigem contexto além da forma.",
        "negative_examples": [
          "Exemplar de legenda/tabela não é ocorrência operacional",
          "Glifos, molduras e líderes de anotação"
        ]
      }
    },
    {
      "id": "cemig-eo-r3-s08-v002",
      "class_code": "POSTE_AT",
      "role": "operational",
      "destination": "support_review",
      "source_ref": {
        "source_id": "F02",
        "pdf_page": 12,
        "locator": "§8; página PDF/impressa 12; desenho/linha 2 da seção nesta página",
        "review_status": "visual_checked"
      },
      "visual_note": "Retângulo",
      "recognition": {
        "status": "pending",
        "reason": "Forma E01: Retângulo. Círculo, retângulo e octógono repetem §3 e outros suportes; material e rede AT exigem contexto além da forma.",
        "negative_examples": [
          "Exemplar de legenda/tabela não é ocorrência operacional",
          "Glifos, molduras e líderes de anotação"
        ]
      }
    },
    {
      "id": "cemig-eo-r3-s08-v003",
      "class_code": "POSTE_AT",
      "role": "operational",
      "destination": "support_review",
      "source_ref": {
        "source_id": "F02",
        "pdf_page": 12,
        "locator": "§8; página PDF/impressa 12; desenho/linha 3 da seção nesta página",
        "review_status": "visual_checked"
      },
      "visual_note": "Círculo",
      "recognition": {
        "status": "pending",
        "reason": "Forma E01: Círculo. Círculo, retângulo e octógono repetem §3 e outros suportes; material e rede AT exigem contexto além da forma.",
        "negative_examples": [
          "Exemplar de legenda/tabela não é ocorrência operacional",
          "Glifos, molduras e líderes de anotação"
        ]
      }
    },
    {
      "id": "cemig-eo-r3-s08-v004",
      "class_code": "POSTE_AT",
      "role": "operational",
      "destination": "support_review",
      "source_ref": {
        "source_id": "F02",
        "pdf_page": 12,
        "locator": "§8; página PDF/impressa 12; desenho/linha 4 da seção nesta página",
        "review_status": "visual_checked"
      },
      "visual_note": "Octógono",
      "recognition": {
        "status": "pending",
        "reason": "Forma E01: Octógono. Círculo, retângulo e octógono repetem §3 e outros suportes; material e rede AT exigem contexto além da forma.",
        "negative_examples": [
          "Exemplar de legenda/tabela não é ocorrência operacional",
          "Glifos, molduras e líderes de anotação"
        ]
      }
    },
    {
      "id": "cemig-eo-r3-s08-v005",
      "class_code": "POSTE_AT",
      "role": "operational",
      "destination": "support_review",
      "source_ref": {
        "source_id": "F02",
        "pdf_page": 12,
        "locator": "§8; página PDF/impressa 12; desenho/linha 5 da seção nesta página",
        "review_status": "visual_checked"
      },
      "visual_note": "Octógono",
      "recognition": {
        "status": "pending",
        "reason": "Forma E01: Octógono. Círculo, retângulo e octógono repetem §3 e outros suportes; material e rede AT exigem contexto além da forma.",
        "negative_examples": [
          "Exemplar de legenda/tabela não é ocorrência operacional",
          "Glifos, molduras e líderes de anotação"
        ]
      }
    },
    {
      "id": "cemig-eo-r3-s08-v006",
      "class_code": "POSTE_AT",
      "role": "operational",
      "destination": "support_review",
      "source_ref": {
        "source_id": "F02",
        "pdf_page": 12,
        "locator": "§8; página PDF/impressa 12; desenho/linha 6 da seção nesta página",
        "review_status": "visual_checked"
      },
      "visual_note": "Anel com centro preto",
      "recognition": {
        "status": "pending",
        "reason": "Forma E01: Anel com centro preto. Círculo, retângulo e octógono repetem §3 e outros suportes; material e rede AT exigem contexto além da forma.",
        "negative_examples": [
          "Exemplar de legenda/tabela não é ocorrência operacional",
          "Glifos, molduras e líderes de anotação"
        ]
      }
    }
  ]
}
