{
  "schema_version": 1,
  "family_id": "family-f02-09",
  "profile_id": "profile-cemig-eo-r3",
  "source_id": "F02",
  "variants": [
    {
      "id": "cemig-eo-r3-s09-v001",
      "class_code": "SUBESTACAO",
      "role": "operational",
      "destination": "network_context",
      "source_ref": {
        "source_id": "F02",
        "pdf_page": 12,
        "locator": "§9; página PDF/impressa 12; desenho/linha 1 da seção nesta página",
        "review_status": "visual_checked"
      },
      "visual_note": "Quadrado vazio",
      "recognition": {
        "status": "pending",
        "reason": "Forma E01: Quadrado vazio. Quadrado simples e cor isolada não distinguem subestação de quadros de legenda ou outras estruturas.",
        "negative_examples": [
          "Exemplar de legenda/tabela não é ocorrência operacional",
          "Glifos, molduras e líderes de anotação"
        ]
      }
    },
    {
      "id": "cemig-eo-r3-s09-v002",
      "class_code": "SUBESTACAO",
      "role": "operational",
      "destination": "network_context",
      "source_ref": {
        "source_id": "F02",
        "pdf_page": 12,
        "locator": "§9; página PDF/impressa 12; desenho/linha 2 da seção nesta página",
        "review_status": "visual_checked"
      },
      "visual_note": "Quadrado laranja",
      "recognition": {
        "status": "pending",
        "reason": "Forma E01: Quadrado laranja. Quadrado simples e cor isolada não distinguem subestação de quadros de legenda ou outras estruturas.",
        "negative_examples": [
          "Exemplar de legenda/tabela não é ocorrência operacional",
          "Glifos, molduras e líderes de anotação"
        ]
      }
    },
    {
      "id": "cemig-eo-r3-s09-v003",
      "class_code": "SUBESTACAO",
      "role": "operational",
      "destination": "network_context",
      "source_ref": {
        "source_id": "F02",
        "pdf_page": 12,
        "locator": "§9; página PDF/impressa 12; desenho/linha 3 da seção nesta página",
        "review_status": "visual_checked"
      },
      "visual_note": "Quadrado azul",
      "recognition": {
        "status": "pending",
        "reason": "Forma E01: Quadrado azul. Quadrado simples e cor isolada não distinguem subestação de quadros de legenda ou outras estruturas.",
        "negative_examples": [
          "Exemplar de legenda/tabela não é ocorrência operacional",
          "Glifos, molduras e líderes de anotação"
        ]
      }
    },
    {
      "id": "cemig-eo-r3-s09-v004",
      "class_code": "SUBESTACAO",
      "role": "operational",
      "destination": "network_context",
      "source_ref": {
        "source_id": "F02",
        "pdf_page": 12,
        "locator": "§9; página PDF/impressa 12; desenho/linha 4 da seção nesta página",
        "review_status": "visual_checked"
      },
      "visual_note": "Quadrado verde escuro",
      "recognition": {
        "status": "pending",
        "reason": "Forma E01: Quadrado verde escuro. Quadrado simples e cor isolada não distinguem subestação de quadros de legenda ou outras estruturas.",
        "negative_examples": [
          "Exemplar de legenda/tabela não é ocorrência operacional",
          "Glifos, molduras e líderes de anotação"
        ]
      }
    }
  ]
}
