{
  "schema_version": 1,
  "family_id": "family-f02-04",
  "profile_id": "profile-cemig-eo-r3",
  "source_id": "F02",
  "variants": [
    {
      "id": "cemig-eo-r3-s04-v001",
      "class_code": "CONVENCAO_EO",
      "role": "informative",
      "destination": "document_convention",
      "source_ref": {
        "source_id": "F02",
        "pdf_page": 8,
        "locator": "§4; página PDF/impressa 8; desenho/linha 1 da seção nesta página",
        "review_status": "visual_checked"
      },
      "visual_note": "Linha verde angular com terminações em colchete",
      "recognition": {
        "status": "pending",
        "reason": "Forma E01: Linha verde angular com terminações em colchete. O V com colchetes coincide com Galeria em §5 p10; a forma isolada não separa rota subterrânea de galeria.",
        "negative_examples": [
          "Exemplar de legenda/tabela não é ocorrência operacional",
          "Glifos, molduras e líderes de anotação"
        ]
      }
    }
  ]
}
