{
  "schema_version": 1,
  "family_id": "family-f02-21",
  "profile_id": "profile-cemig-eo-r3",
  "source_id": "F02",
  "variants": [
    {
      "id": "cemig-eo-r3-s21-v009",
      "class_code": "EQUIPAMENTO_PROTECAO",
      "role": "operational",
      "destination": "equipment_review",
      "source_ref": {
        "source_id": "F02",
        "pdf_page": 27,
        "locator": "§21; página PDF/impressa 27; desenho/linha 9 da seção nesta página",
        "review_status": "visual_checked"
      },
      "visual_note": "Triângulo preto em retângulo ligado a aterramento",
      "recognition": {
        "status": "pending",
        "reason": "Forma E01: Triângulo preto em retângulo ligado a aterramento. Símbolo de proteção requer componente de aterramento/IF e estado; círculo ou triângulo isolado não basta.",
        "negative_examples": [
          "Exemplar de legenda/tabela não é ocorrência operacional",
          "Glifos, molduras e líderes de anotação",
          "Círculos de situação e componentes não equivalem a ativos adicionais",
          "Detalhe ampliado pode repetir a mesma ocorrência"
        ]
      }
    },
    {
      "id": "cemig-eo-r3-s21-v010",
      "class_code": "EQUIPAMENTO_PROTECAO",
      "role": "operational",
      "destination": "equipment_review",
      "source_ref": {
        "source_id": "F02",
        "pdf_page": 27,
        "locator": "§21; página PDF/impressa 27; desenho/linha 10 da seção nesta página",
        "review_status": "visual_checked"
      },
      "visual_note": "IF em círculo amarelo; símbolo base",
      "recognition": {
        "status": "pending",
        "reason": "Forma E01: IF em círculo amarelo; símbolo base. Símbolo de proteção requer componente de aterramento/IF e estado; círculo ou triângulo isolado não basta.",
        "negative_examples": [
          "Exemplar de legenda/tabela não é ocorrência operacional",
          "Glifos, molduras e líderes de anotação",
          "Círculos de situação e componentes não equivalem a ativos adicionais",
          "Detalhe ampliado pode repetir a mesma ocorrência"
        ]
      }
    },
    {
      "id": "cemig-eo-r3-s21-v011",
      "class_code": "EQUIPAMENTO_PROTECAO",
      "role": "operational",
      "destination": "equipment_review",
      "source_ref": {
        "source_id": "F02",
        "pdf_page": 27,
        "locator": "§21; página PDF/impressa 27; desenho/linha 11 da seção nesta página",
        "review_status": "visual_checked"
      },
      "visual_note": "IF em círculo amarelo; círculo/oval envolvente",
      "recognition": {
        "status": "pending",
        "reason": "Forma E01: IF em círculo amarelo; círculo/oval envolvente. Símbolo de proteção requer componente de aterramento/IF e estado; círculo ou triângulo isolado não basta.",
        "negative_examples": [
          "Exemplar de legenda/tabela não é ocorrência operacional",
          "Glifos, molduras e líderes de anotação",
          "Círculos de situação e componentes não equivalem a ativos adicionais",
          "Detalhe ampliado pode repetir a mesma ocorrência"
        ]
      }
    },
    {
      "id": "cemig-eo-r3-s21-v012",
      "class_code": "EQUIPAMENTO_PROTECAO",
      "role": "operational",
      "destination": "equipment_review",
      "source_ref": {
        "source_id": "F02",
        "pdf_page": 27,
        "locator": "§21; página PDF/impressa 27; desenho/linha 12 da seção nesta página",
        "review_status": "visual_checked"
      },
      "visual_note": "IF em círculo amarelo; círculo/oval e X vermelho",
      "recognition": {
        "status": "pending",
        "reason": "Forma E01: IF em círculo amarelo; círculo/oval e X vermelho. Símbolo de proteção requer componente de aterramento/IF e estado; círculo ou triângulo isolado não basta.",
        "negative_examples": [
          "Exemplar de legenda/tabela não é ocorrência operacional",
          "Glifos, molduras e líderes de anotação",
          "Círculos de situação e componentes não equivalem a ativos adicionais",
          "Detalhe ampliado pode repetir a mesma ocorrência"
        ]
      }
    },
    {
      "id": "cemig-eo-r3-s21-v013",
      "class_code": "EQUIPAMENTO_PROTECAO",
      "role": "operational",
      "destination": "equipment_review",
      "source_ref": {
        "source_id": "F02",
        "pdf_page": 27,
        "locator": "§21; página PDF/impressa 27; desenho/linha 13 da seção nesta página",
        "review_status": "visual_checked"
      },
      "visual_note": "IF em círculo amarelo; X vermelho sem envolvente",
      "recognition": {
        "status": "pending",
        "reason": "Forma E01: IF em círculo amarelo; X vermelho sem envolvente. Símbolo de proteção requer componente de aterramento/IF e estado; círculo ou triângulo isolado não basta.",
        "negative_examples": [
          "Exemplar de legenda/tabela não é ocorrência operacional",
          "Glifos, molduras e líderes de anotação",
          "Círculos de situação e componentes não equivalem a ativos adicionais",
          "Detalhe ampliado pode repetir a mesma ocorrência"
        ]
      }
    },
    {
      "id": "cemig-eo-r3-s21-v014",
      "class_code": "EQUIPAMENTO_PROTECAO",
      "role": "operational",
      "destination": "equipment_review",
      "source_ref": {
        "source_id": "F02",
        "pdf_page": 28,
        "locator": "§21; página PDF/impressa 28; desenho/linha 1 da seção nesta página",
        "review_status": "visual_checked"
      },
      "visual_note": "Zigue-zague",
      "recognition": {
        "status": "pending",
        "reason": "Forma E01: Zigue-zague. Símbolo de proteção requer componente de aterramento/IF e estado; círculo ou triângulo isolado não basta.",
        "negative_examples": [
          "Exemplar de legenda/tabela não é ocorrência operacional",
          "Glifos, molduras e líderes de anotação",
          "Círculos de situação e componentes não equivalem a ativos adicionais",
          "Detalhe ampliado pode repetir a mesma ocorrência"
        ]
      }
    },
    {
      "id": "cemig-eo-r3-s21-v015",
      "class_code": "EQUIPAMENTO_PROTECAO",
      "role": "operational",
      "destination": "equipment_review",
      "source_ref": {
        "source_id": "F02",
        "pdf_page": 28,
        "locator": "§21; página PDF/impressa 28; desenho/linha 2 da seção nesta página",
        "review_status": "visual_checked"
      },
      "visual_note": "Dois triângulos opostos em eixo",
      "recognition": {
        "status": "pending",
        "reason": "Forma E01: Dois triângulos opostos em eixo. Símbolo de proteção requer componente de aterramento/IF e estado; círculo ou triângulo isolado não basta.",
        "negative_examples": [
          "Exemplar de legenda/tabela não é ocorrência operacional",
          "Glifos, molduras e líderes de anotação",
          "Círculos de situação e componentes não equivalem a ativos adicionais",
          "Detalhe ampliado pode repetir a mesma ocorrência"
        ]
      }
    }
  ]
}
