{
  "schema_version": 1,
  "family_id": "family-f02-06",
  "profile_id": "profile-cemig-eo-r3",
  "source_id": "F02",
  "variants": [
    {
      "id": "cemig-eo-r3-s06-v001",
      "class_code": "CAMARA",
      "role": "operational",
      "destination": "network_context",
      "source_ref": {
        "source_id": "F02",
        "pdf_page": 10,
        "locator": "§6; página PDF/impressa 10; desenho/linha 1 da seção nesta página",
        "review_status": "visual_checked"
      },
      "visual_note": "Retângulo vermelho com CT; preenchimento diagonal ou X; contorno/base",
      "recognition": {
        "status": "enabled",
        "grammar": {
          "kind": "label_in_frame",
          "empty_interior": true,
          "frame": "rectangle",
          "max_span": 96,
          "max_aspect": 3.5,
          "label": "CT"
        },
        "negative_examples": [
          "Exemplar de legenda/tabela não é ocorrência operacional",
          "Glifos, molduras e líderes de anotação",
          "Mesmo literal em quadro com triângulo preenchido ou X de proposta não é o estado base"
        ]
      }
    },
    {
      "id": "cemig-eo-r3-s06-v002",
      "class_code": "CAMARA",
      "role": "operational",
      "destination": "network_context",
      "source_ref": {
        "source_id": "F02",
        "pdf_page": 10,
        "locator": "§6; página PDF/impressa 10; desenho/linha 2 da seção nesta página",
        "review_status": "visual_checked"
      },
      "visual_note": "Retângulo vermelho com CT; preenchimento diagonal ou X; preenchimento de instalação",
      "recognition": {
        "status": "pending",
        "reason": "Forma E01: Retângulo vermelho com CT; preenchimento diagonal ou X; preenchimento de instalação. Triângulo preenchido e X mudam situação do mesmo quadro CT/CL/CM; falta gramática e negativo específicos deste estado.",
        "negative_examples": [
          "Exemplar de legenda/tabela não é ocorrência operacional",
          "Glifos, molduras e líderes de anotação"
        ]
      }
    },
    {
      "id": "cemig-eo-r3-s06-v003",
      "class_code": "CAMARA",
      "role": "operational",
      "destination": "network_context",
      "source_ref": {
        "source_id": "F02",
        "pdf_page": 10,
        "locator": "§6; página PDF/impressa 10; desenho/linha 3 da seção nesta página",
        "review_status": "visual_checked"
      },
      "visual_note": "Retângulo vermelho com CT; preenchimento diagonal ou X; marca de retirada/substituição",
      "recognition": {
        "status": "pending",
        "reason": "Forma E01: Retângulo vermelho com CT; preenchimento diagonal ou X; marca de retirada/substituição. Triângulo preenchido e X mudam situação do mesmo quadro CT/CL/CM; falta gramática e negativo específicos deste estado.",
        "negative_examples": [
          "Exemplar de legenda/tabela não é ocorrência operacional",
          "Glifos, molduras e líderes de anotação"
        ]
      }
    },
    {
      "id": "cemig-eo-r3-s06-v004",
      "class_code": "CAMARA",
      "role": "operational",
      "destination": "network_context",
      "source_ref": {
        "source_id": "F02",
        "pdf_page": 10,
        "locator": "§6; página PDF/impressa 10; desenho/linha 4 da seção nesta página",
        "review_status": "visual_checked"
      },
      "visual_note": "Retângulo com CL",
      "recognition": {
        "status": "enabled",
        "grammar": {
          "kind": "label_in_frame",
          "empty_interior": true,
          "frame": "rectangle",
          "max_span": 96,
          "max_aspect": 3.5,
          "label": "CL"
        },
        "negative_examples": [
          "Exemplar de legenda/tabela não é ocorrência operacional",
          "Glifos, molduras e líderes de anotação",
          "Mesmo literal em quadro com triângulo preenchido ou X de proposta não é o estado base"
        ]
      }
    },
    {
      "id": "cemig-eo-r3-s06-v005",
      "class_code": "CAMARA",
      "role": "operational",
      "destination": "network_context",
      "source_ref": {
        "source_id": "F02",
        "pdf_page": 11,
        "locator": "§6; página PDF/impressa 11; desenho/linha 1 da seção nesta página",
        "review_status": "visual_checked"
      },
      "visual_note": "Retângulo CL e preenchimento diagonal",
      "recognition": {
        "status": "pending",
        "reason": "Forma E01: Retângulo CL e preenchimento diagonal. Triângulo preenchido e X mudam situação do mesmo quadro CT/CL/CM; falta gramática e negativo específicos deste estado.",
        "negative_examples": [
          "Exemplar de legenda/tabela não é ocorrência operacional",
          "Glifos, molduras e líderes de anotação"
        ]
      }
    },
    {
      "id": "cemig-eo-r3-s06-v006",
      "class_code": "CAMARA",
      "role": "operational",
      "destination": "network_context",
      "source_ref": {
        "source_id": "F02",
        "pdf_page": 11,
        "locator": "§6; página PDF/impressa 11; desenho/linha 2 da seção nesta página",
        "review_status": "visual_checked"
      },
      "visual_note": "Retângulo CL com X",
      "recognition": {
        "status": "pending",
        "reason": "Forma E01: Retângulo CL com X. Triângulo preenchido e X mudam situação do mesmo quadro CT/CL/CM; falta gramática e negativo específicos deste estado.",
        "negative_examples": [
          "Exemplar de legenda/tabela não é ocorrência operacional",
          "Glifos, molduras e líderes de anotação"
        ]
      }
    },
    {
      "id": "cemig-eo-r3-s06-v007",
      "class_code": "CAMARA",
      "role": "operational",
      "destination": "network_context",
      "source_ref": {
        "source_id": "F02",
        "pdf_page": 11,
        "locator": "§6; página PDF/impressa 11; desenho/linha 3 da seção nesta página",
        "review_status": "visual_checked"
      },
      "visual_note": "Retângulo CM; diagonal preenchida ou X; contorno/base",
      "recognition": {
        "status": "enabled",
        "grammar": {
          "kind": "label_in_frame",
          "empty_interior": true,
          "frame": "rectangle",
          "max_span": 96,
          "max_aspect": 3.5,
          "label": "CM"
        },
        "negative_examples": [
          "Exemplar de legenda/tabela não é ocorrência operacional",
          "Glifos, molduras e líderes de anotação",
          "Mesmo literal em quadro com triângulo preenchido ou X de proposta não é o estado base"
        ]
      }
    },
    {
      "id": "cemig-eo-r3-s06-v008",
      "class_code": "CAMARA",
      "role": "operational",
      "destination": "network_context",
      "source_ref": {
        "source_id": "F02",
        "pdf_page": 11,
        "locator": "§6; página PDF/impressa 11; desenho/linha 4 da seção nesta página",
        "review_status": "visual_checked"
      },
      "visual_note": "Retângulo CM; diagonal preenchida ou X; preenchimento de instalação",
      "recognition": {
        "status": "pending",
        "reason": "Forma E01: Retângulo CM; diagonal preenchida ou X; preenchimento de instalação. Triângulo preenchido e X mudam situação do mesmo quadro CT/CL/CM; falta gramática e negativo específicos deste estado.",
        "negative_examples": [
          "Exemplar de legenda/tabela não é ocorrência operacional",
          "Glifos, molduras e líderes de anotação"
        ]
      }
    },
    {
      "id": "cemig-eo-r3-s06-v009",
      "class_code": "CAMARA",
      "role": "operational",
      "destination": "network_context",
      "source_ref": {
        "source_id": "F02",
        "pdf_page": 11,
        "locator": "§6; página PDF/impressa 11; desenho/linha 5 da seção nesta página",
        "review_status": "visual_checked"
      },
      "visual_note": "Retângulo CM; diagonal preenchida ou X; marca de retirada/substituição",
      "recognition": {
        "status": "pending",
        "reason": "Forma E01: Retângulo CM; diagonal preenchida ou X; marca de retirada/substituição. Triângulo preenchido e X mudam situação do mesmo quadro CT/CL/CM; falta gramática e negativo específicos deste estado.",
        "negative_examples": [
          "Exemplar de legenda/tabela não é ocorrência operacional",
          "Glifos, molduras e líderes de anotação"
        ]
      }
    }
  ]
}
