{
  "schema_version": 1,
  "family_id": "family-f02-12",
  "profile_id": "profile-cemig-eo-r3",
  "source_id": "F02",
  "variants": [
    {
      "id": "cemig-eo-r3-s12-v001",
      "class_code": "ESTRUTURA_POSTE_AT",
      "role": "operational",
      "destination": "support_review",
      "source_ref": {
        "source_id": "F02",
        "pdf_page": 14,
        "locator": "§12; página PDF/impressa 14; desenho/linha 1 da seção nesta página",
        "review_status": "visual_checked"
      },
      "visual_note": "Quadrado",
      "recognition": {
        "status": "pending",
        "reason": "Forma E01: Quadrado. Quadrado e retângulos repetem §10; proporção na tabela não comprova tipo de suporte num projeto.",
        "negative_examples": [
          "Exemplar de legenda/tabela não é ocorrência operacional",
          "Glifos, molduras e líderes de anotação"
        ]
      }
    },
    {
      "id": "cemig-eo-r3-s12-v002",
      "class_code": "ESTRUTURA_POSTE_AT",
      "role": "operational",
      "destination": "support_review",
      "source_ref": {
        "source_id": "F02",
        "pdf_page": 14,
        "locator": "§12; página PDF/impressa 14; desenho/linha 2 da seção nesta página",
        "review_status": "visual_checked"
      },
      "visual_note": "Retângulo horizontal",
      "recognition": {
        "status": "pending",
        "reason": "Forma E01: Retângulo horizontal. Quadrado e retângulos repetem §10; proporção na tabela não comprova tipo de suporte num projeto.",
        "negative_examples": [
          "Exemplar de legenda/tabela não é ocorrência operacional",
          "Glifos, molduras e líderes de anotação"
        ]
      }
    },
    {
      "id": "cemig-eo-r3-s12-v003",
      "class_code": "ESTRUTURA_POSTE_AT",
      "role": "operational",
      "destination": "support_review",
      "source_ref": {
        "source_id": "F02",
        "pdf_page": 14,
        "locator": "§12; página PDF/impressa 14; desenho/linha 3 da seção nesta página",
        "review_status": "visual_checked"
      },
      "visual_note": "Retângulo horizontal longo",
      "recognition": {
        "status": "pending",
        "reason": "Forma E01: Retângulo horizontal longo. Quadrado e retângulos repetem §10; proporção na tabela não comprova tipo de suporte num projeto.",
        "negative_examples": [
          "Exemplar de legenda/tabela não é ocorrência operacional",
          "Glifos, molduras e líderes de anotação"
        ]
      }
    }
  ]
}
