{
  "schema_version": 1,
  "family_id": "family-f02-31",
  "profile_id": "profile-cemig-eo-r3",
  "source_id": "F02",
  "variants": [
    {
      "id": "cemig-eo-r3-s31-v001",
      "class_code": "CONCENTRADOR_SECUNDARIO",
      "role": "operational",
      "destination": "equipment_review",
      "source_ref": {
        "source_id": "F02",
        "pdf_page": 33,
        "locator": "§31; página PDF/impressa 33; desenho/linha 1 da seção nesta página",
        "review_status": "visual_checked"
      },
      "visual_note": "CS girado em quadrado",
      "recognition": {
        "status": "enabled",
        "grammar": {
          "max_span": 72,
          "label": "CS",
          "kind": "label_in_frame",
          "frame": "rectangle"
        },
        "negative_examples": [
          "Exemplar de legenda/tabela não é ocorrência operacional",
          "Glifos, molduras e líderes de anotação",
          "Texto ou moldura isolados sem a composição geométrica exigida"
        ]
      }
    }
  ]
}
