{
  "schema_version": 1,
  "family_id": "family-f02-07",
  "profile_id": "profile-cemig-eo-r3",
  "source_id": "F02",
  "variants": [
    {
      "id": "cemig-eo-r3-s07-v001",
      "class_code": "PLATAFORMA",
      "role": "operational",
      "destination": "network_context",
      "source_ref": {
        "source_id": "F02",
        "pdf_page": 11,
        "locator": "§7; página PDF/impressa 11; desenho/linha 1 da seção nesta página",
        "review_status": "visual_checked"
      },
      "visual_note": "Triângulo vazado em quadrado",
      "recognition": {
        "status": "enabled",
        "grammar": {
          "max_span": 72,
          "frame": "rectangle",
          "fill": "empty",
          "kind": "triangle_in_frame"
        },
        "negative_examples": [
          "Exemplar de legenda/tabela não é ocorrência operacional",
          "Glifos, molduras e líderes de anotação",
          "Quadrado sem triângulo interno ou com preenchimento oposto não é esta variante"
        ]
      }
    },
    {
      "id": "cemig-eo-r3-s07-v002",
      "class_code": "PLATAFORMA",
      "role": "operational",
      "destination": "network_context",
      "source_ref": {
        "source_id": "F02",
        "pdf_page": 11,
        "locator": "§7; página PDF/impressa 11; desenho/linha 2 da seção nesta página",
        "review_status": "visual_checked"
      },
      "visual_note": "Triângulo preenchido em quadrado",
      "recognition": {
        "status": "enabled",
        "grammar": {
          "max_span": 72,
          "frame": "rectangle",
          "fill": "solid",
          "kind": "triangle_in_frame"
        },
        "negative_examples": [
          "Exemplar de legenda/tabela não é ocorrência operacional",
          "Glifos, molduras e líderes de anotação",
          "Quadrado sem triângulo interno ou com preenchimento oposto não é esta variante"
        ]
      }
    },
    {
      "id": "cemig-eo-r3-s07-v003",
      "class_code": "PLATAFORMA",
      "role": "operational",
      "destination": "network_context",
      "source_ref": {
        "source_id": "F02",
        "pdf_page": 11,
        "locator": "§7; página PDF/impressa 11; desenho/linha 3 da seção nesta página",
        "review_status": "visual_checked"
      },
      "visual_note": "QDP em retângulo",
      "recognition": {
        "status": "enabled",
        "grammar": {
          "max_span": 72,
          "label": "QDP",
          "kind": "label_in_frame",
          "frame": "rectangle"
        },
        "negative_examples": [
          "Exemplar de legenda/tabela não é ocorrência operacional",
          "Glifos, molduras e líderes de anotação",
          "Texto ou moldura isolados sem a composição geométrica exigida"
        ]
      }
    },
    {
      "id": "cemig-eo-r3-s07-v004",
      "class_code": "PLATAFORMA",
      "role": "operational",
      "destination": "network_context",
      "source_ref": {
        "source_id": "F02",
        "pdf_page": 11,
        "locator": "§7; página PDF/impressa 11; desenho/linha 4 da seção nesta página",
        "review_status": "visual_checked"
      },
      "visual_note": "GDM em retângulo",
      "recognition": {
        "status": "enabled",
        "grammar": {
          "max_span": 72,
          "label": "GDM",
          "kind": "label_in_frame",
          "frame": "rectangle"
        },
        "negative_examples": [
          "Exemplar de legenda/tabela não é ocorrência operacional",
          "Glifos, molduras e líderes de anotação",
          "Texto ou moldura isolados sem a composição geométrica exigida"
        ]
      }
    },
    {
      "id": "cemig-eo-r3-s07-v005",
      "class_code": "PLATAFORMA",
      "role": "operational",
      "destination": "network_context",
      "source_ref": {
        "source_id": "F02",
        "pdf_page": 11,
        "locator": "§7; página PDF/impressa 11; desenho/linha 5 da seção nesta página",
        "review_status": "visual_checked"
      },
      "visual_note": "QDM em retângulo",
      "recognition": {
        "status": "enabled",
        "grammar": {
          "max_span": 72,
          "label": "QDM",
          "kind": "label_in_frame",
          "frame": "rectangle"
        },
        "negative_examples": [
          "Exemplar de legenda/tabela não é ocorrência operacional",
          "Glifos, molduras e líderes de anotação",
          "Texto ou moldura isolados sem a composição geométrica exigida"
        ]
      }
    }
  ]
}
