{
  "schema_version": 1,
  "family_id": "family-f02-11",
  "profile_id": "profile-cemig-eo-r3",
  "source_id": "F02",
  "variants": [
    {
      "id": "cemig-eo-r3-s11-v001",
      "class_code": "TORRE_AT",
      "role": "operational",
      "destination": "support_review",
      "source_ref": {
        "source_id": "F02",
        "pdf_page": 13,
        "locator": "§11; página PDF/impressa 13; desenho/linha 1 da seção nesta página",
        "review_status": "visual_checked"
      },
      "visual_note": "Quadrado com diagonais",
      "recognition": {
        "status": "enabled",
        "grammar": {
          "max_span": 72,
          "min_diagonals": 2,
          "kind": "framed_diagonals",
          "frame": "rectangle"
        },
        "negative_examples": [
          "Exemplar de legenda/tabela não é ocorrência operacional",
          "Glifos, molduras e líderes de anotação",
          "Texto ou moldura isolados sem a composição geométrica exigida",
          "Quadro largo CT/CL/CM com X e texto interno não é torre AT"
        ]
      }
    },
    {
      "id": "cemig-eo-r3-s11-v002",
      "class_code": "TORRE_AT",
      "role": "operational",
      "destination": "support_review",
      "source_ref": {
        "source_id": "F02",
        "pdf_page": 13,
        "locator": "§11; página PDF/impressa 13; desenho/linha 2 da seção nesta página",
        "review_status": "visual_checked"
      },
      "visual_note": "Dois quadrados com diagonais ligados por retângulo",
      "recognition": {
        "status": "pending",
        "reason": "Forma E01: Dois quadrados com diagonais ligados por retângulo. Pórtico-2 e Pórtico-3 compartilham desenho na F02 p13; não duplicar achado sem modelar alternativas da mesma forma.",
        "negative_examples": [
          "Exemplar de legenda/tabela não é ocorrência operacional",
          "Glifos, molduras e líderes de anotação"
        ]
      }
    },
    {
      "id": "cemig-eo-r3-s11-v003",
      "class_code": "TORRE_AT",
      "role": "operational",
      "destination": "support_review",
      "source_ref": {
        "source_id": "F02",
        "pdf_page": 13,
        "locator": "§11; página PDF/impressa 13; desenho/linha 3 da seção nesta página",
        "review_status": "visual_checked"
      },
      "visual_note": "Quadro retangular com dois extremos cruzados",
      "recognition": {
        "status": "pending",
        "reason": "Forma E01: Quadro retangular com dois extremos cruzados. Pórtico-2 e Pórtico-3 compartilham desenho na F02 p13; não duplicar achado sem modelar alternativas da mesma forma.",
        "negative_examples": [
          "Exemplar de legenda/tabela não é ocorrência operacional",
          "Glifos, molduras e líderes de anotação"
        ]
      }
    }
  ]
}
