{
  "schema_version": 1,
  "family_id": "family-f02-29",
  "profile_id": "profile-cemig-eo-r3",
  "source_id": "F02",
  "variants": [
    {
      "id": "cemig-eo-r3-s29-v001",
      "class_code": "PONTO_MEDICAO",
      "role": "operational",
      "destination": "network_context",
      "source_ref": {
        "source_id": "F02",
        "pdf_page": 32,
        "locator": "§29; página PDF/impressa 32; desenho/linha 1 da seção nesta página",
        "review_status": "visual_checked"
      },
      "visual_note": "M girado em círculo amarelo",
      "recognition": {
        "status": "enabled",
        "grammar": {
          "max_span": 72,
          "label": "M",
          "kind": "label_in_frame",
          "frame": "ellipse"
        },
        "negative_examples": [
          "Exemplar de legenda/tabela não é ocorrência operacional",
          "Glifos, molduras e líderes de anotação",
          "Texto ou moldura isolados sem a composição geométrica exigida"
        ]
      }
    }
  ]
}
